{"$id":"https://tri-state-systems-manager/data/schemas/flood-sim-scenario.schema.json","$schema":"https://json-schema.org/draft/2020-12/schema","additionalProperties":false,"description":"Scenario definition for the TSM Level-5 flood simulator (tsm-console/src/lib/flood-sim). Historical-data honesty is enforced structurally: every scenario declares source, provenance, humanReviewRequired, and an explicit provisionalFields list.","properties":{"description":{"minLength":1,"type":"string"},"display":{"additionalProperties":false,"properties":{"defaultQuality":{"enum":["low","medium","high","ultra"],"type":"string"},"defaultTimeScale":{"exclusiveMinimum":0,"type":"number"}},"type":"object"},"engine":{"additionalProperties":false,"properties":{"curveNumber":{"exclusiveMinimum":0,"maximum":100,"type":"number"},"durationHrs":{"exclusiveMinimum":0,"maximum":720,"type":"number"},"dxFt":{"exclusiveMinimum":0,"type":"number"},"gaugeDriven":{"description":"True: rainfall comes from live REST gauge polling at runtime; hyetograph must be null.","type":"boolean"},"hyetograph":{"additionalProperties":false,"properties":{"intensityInPerHr":{"items":{"minimum":0,"type":"number"},"minItems":2,"type":"array"},"timeHrs":{"items":{"type":"number"},"minItems":2,"type":"array"}},"required":["timeHrs","intensityInPerHr"],"type":["object","null"]},"manningN":{"exclusiveMinimum":0,"type":"number"},"nx":{"maximum":256,"minimum":4,"type":"integer"},"ny":{"maximum":256,"minimum":4,"type":"integer"},"seed":{"anyOf":[{"type":"integer"},{"type":"string"}],"description":"Deterministic seed; strings are hashed via FNV-1a (seedFromString)."},"structures":{"items":{"additionalProperties":false,"properties":{"cellCol":{"minimum":0,"type":"integer"},"cellRow":{"minimum":0,"type":"integer"},"contentsValueUsd":{"minimum":0,"type":"number"},"firstFloorElevFt":{"type":"number"},"id":{"type":"string"},"name":{"type":"string"},"occupancyType":{"enum":["RES-1SNB","RES-2SNB","COM","IND"],"type":"string"},"structureValueUsd":{"minimum":0,"type":"number"}},"required":["id","name","occupancyType","cellRow","cellCol","firstFloorElevFt","structureValueUsd"],"type":"object"},"type":"array"},"terrain":{"additionalProperties":false,"properties":{"baseElevFt":{"type":"number"},"elevFt":{"type":"number"},"noiseAmplitudeFt":{"minimum":0,"type":"number"},"octaves":{"maximum":4,"minimum":1,"type":"integer"},"type":{"enum":["procedural","flat"],"type":"string"},"valleyReliefFt":{"type":"number"}},"required":["type"],"type":"object"},"watershedAreaSqMi":{"exclusiveMinimum":0,"type":"number"}},"required":["seed","nx","ny","dxFt","manningN","durationHrs","curveNumber","watershedAreaSqMi","terrain","gaugeDriven"],"type":"object"},"humanReviewRequired":{"description":"Must be true: simulation outputs inform; human authority remains final.","type":"boolean"},"provenance":{"description":"Repo provenance taxonomy layer for the scenario definition itself. Engine outputs are always 'simulation'.","enum":["simulation","observed","modeled","forecast","FEMA-effective","State-best"],"type":"string"},"provisional":{"description":"True when any field is provisional (unverified / illustrative / user-supplied).","type":"boolean"},"provisionalFields":{"description":"Explicit list of every provisional field. Empty only when provisional=false.","items":{"type":"string"},"type":"array"},"scenarioId":{"description":"Stable kebab-case id, also used to derive the deterministic PRNG seed.","pattern":"^[a-z0-9-]+$","type":"string"},"source":{"description":"Citation for the scenario's factual basis (file path + line, URL, or 'operator-supplied').","minLength":1,"type":"string"},"sourcedValues":{"description":"Numeric values with a verifiable source. Everything NOT listed here is provisional or computed.","items":{"additionalProperties":false,"properties":{"field":{"type":"string"},"source":{"type":"string"},"unit":{"type":"string"},"value":{"type":"number"}},"required":["field","value","unit","source"],"type":"object"},"type":"array"},"title":{"minLength":1,"type":"string"}},"required":["scenarioId","title","description","source","provenance","humanReviewRequired","provisional","provisionalFields","engine"],"title":"Flood Simulator Scenario","type":"object"}