{"description": "Screening-level replay of the January\u2013February 1937 Great Ohio River Flood as it would have affected the Point Township anchor site. HISTORICAL-DATA HONESTY: the ONLY sourced numeric value in this scenario is the Evansville peak stage of 54.0 ft (USGS 03322000), cited below. There is no numeric 1937 crest time series anywhere in the TSM repository; the hyetograph, timing, local depths, and damage figures in this file are PROVISIONAL \u2014 illustrative placeholders an operator must replace with sourced values before any evidentiary use. Previously this scenario id existed in code but was UNBOUND; this file binds it explicitly as provisional.", "display": {"defaultQuality": "medium", "defaultTimeScale": 120}, "engine": {"curveNumber": 78, "durationHrs": 72, "dxFt": 220, "gaugeDriven": false, "hyetograph": {"intensityInPerHr": [0.05, 0.08, 0.12, 0.18, 0.25, 0.32, 0.4, 0.45, 0.42, 0.35, 0.28, 0.2, 0.14, 0.1, 0.07, 0.05, 0.03, 0.02, 0.0], "timeHrs": [0, 4, 8, 12, 16, 20, 24, 28, 32, 36, 40, 44, 48, 52, 56, 60, 64, 68, 72]}, "manningN": 0.045, "nx": 48, "ny": 48, "seed": "1937-ohio-river-flood", "structures": [{"cellCol": 24, "cellRow": 26, "contentsValueUsd": 60000, "firstFloorElevFt": 379.5, "id": "bonebank-farmstead-1937", "name": "Bonebank Rd farmstead (illustrative 1937 structure)", "occupancyType": "RES-1SNB", "structureValueUsd": 180000}, {"cellCol": 20, "cellRow": 30, "contentsValueUsd": 25000, "firstFloorElevFt": 378.0, "id": "point-township-barn-1937", "name": "Outbuilding (illustrative)", "occupancyType": "COM", "structureValueUsd": 90000}], "terrain": {"baseElevFt": 376.5, "noiseAmplitudeFt": 2.5, "octaves": 3, "type": "procedural", "valleyReliefFt": 9}, "watershedAreaSqMi": 12.5}, "humanReviewRequired": true, "provenance": "simulation", "provisional": true, "provisionalFields": ["engine.hyetograph (no 1937 rainfall time series exists in the repository; shape is illustrative)", "engine.terrain (procedural approximation; no 1937 surveyed elevation)", "engine.structures (illustrative placements and values, not historical records)", "engine.curveNumber / engine.watershedAreaSqMi (screening assumptions, not calibrated)", "engine.manningN (screening assumption)", "all depth / damage / discharge outputs (computed, not observed)"], "scenarioId": "1937-ohio-river-flood", "source": "docs/grants/bric-fy2025-subapplication-narrative.md \u2014 1937 Great Ohio River Flood; Evansville IN gauge (USGS 03322000) peak stage 54.0 ft; >300,000 acres inundated tri-state; Point Township completely submerged. (The narrative's mention of flood stage is not repeated here: 54.0 ft is the only verified numeric value carried into this file.)", "sourcedValues": [{"field": "evansvillePeakStageFt", "source": "docs/grants/bric-fy2025-subapplication-narrative.md (citing USGS 03322000)", "unit": "ft stage", "value": 54.0}], "title": "1937 Ohio River Flood (provisional replay)"}