{
  "description": "Regulatory design event for the anchor site: 1%-annual-chance (100-year) flood anchored to the FEMA-effective Base Flood Elevation of 369.1 ft NAVD88 (FIS 18129CV000A Table 9, Section A). Site constants (BFE 369.1 / LAG 377.2 / FFE 382.5 / BERM 379.8 ft NAVD88) are owner-supplied values carried in tsm-console/src/lib/scientific-analytics.ts. The 24-hour hyetograph is a screening-level triangular design storm — provisional as a storm shape; the BFE/LAG/panel facts are sourced. All depths and damages are computed (simulation), not observed.",
  "display": {
    "defaultQuality": "medium",
    "defaultTimeScale": 60
  },
  "engine": {
    "curveNumber": 82,
    "durationHrs": 24,
    "dxFt": 200,
    "gaugeDriven": false,
    "hyetograph": {
      "intensityInPerHr": [
        0.1,
        0.15,
        0.22,
        0.3,
        0.42,
        0.55,
        0.7,
        0.85,
        1,
        1.1,
        1,
        0.85,
        0.7,
        0.55,
        0.42,
        0.3,
        0.22,
        0.15,
        0.12,
        0.1,
        0.08,
        0.06,
        0.05,
        0.04,
        0
      ],
      "timeHrs": [
        0,
        1,
        2,
        3,
        4,
        5,
        6,
        7,
        8,
        9,
        10,
        11,
        12,
        13,
        14,
        15,
        16,
        17,
        18,
        19,
        20,
        21,
        22,
        23,
        24
      ]
    },
    "manningN": 0.04,
    "nx": 48,
    "ny": 48,
    "seed": "q100-design-event",
    "structures": [
      {
        "cellCol": 24,
        "cellRow": 24,
        "contentsValueUsd": 80000,
        "firstFloorElevFt": 382.5,
        "id": "bonebank-residence",
        "name": "13101 Bonebank Rd residence (FFE 382.5 ft)",
        "occupancyType": "RES-1SNB",
        "structureValueUsd": 250000
      },
      {
        "cellCol": 18,
        "cellRow": 30,
        "contentsValueUsd": 40000,
        "firstFloorElevFt": 379.8,
        "id": "bonebank-outbuilding",
        "name": "Outbuilding near berm crest (379.8 ft)",
        "occupancyType": "COM",
        "structureValueUsd": 120000
      },
      {
        "cellCol": 30,
        "cellRow": 18,
        "contentsValueUsd": 0,
        "firstFloorElevFt": 377.2,
        "id": "lag-probe-point",
        "name": "LAG probe point (377.2 ft, arithmetic only)",
        "occupancyType": "RES-2SNB",
        "structureValueUsd": 200000
      }
    ],
    "terrain": {
      "baseElevFt": 374,
      "noiseAmplitudeFt": 2,
      "octaves": 3,
      "type": "procedural",
      "valleyReliefFt": 8
    },
    "watershedAreaSqMi": 8
  },
  "humanReviewRequired": true,
  "provenance": "simulation",
  "provisional": true,
  "provisionalFields": [
    "engine.hyetograph (screening-level triangular design storm, not a NOAA Atlas 14 hyetograph)",
    "engine.terrain (procedural approximation anchored near BFE; not surveyed elevation)",
    "engine.structures (illustrative placements; first-floor elevations from owner-supplied constants)",
    "engine.curveNumber / engine.watershedAreaSqMi / engine.manningN (screening assumptions)",
    "all depth / damage / discharge outputs (computed, not observed)"
  ],
  "scenarioId": "q100-design-event",
  "source": "FEMA FIS 18129CV000A Table 9, Section A (reference BFE 369.1 ft NAVD88; see docs/validation/BFE-CORRECTION-2026-10-18.md). FEMA FIRM panel 18129C0265C is retained as mapping context only. Parcel applicability remains unverified because the address and asserted surveyed centroid differ by ~6.4 km and the sampled effective FIRM layer has no usable BFE.",
  "sourcedValues": [
    {
      "field": "baseFloodElevationFtNavd88",
      "source": "FEMA FIS 18129CV000A Table 9, Section A (reference BFE; parcel applicability unverified; see docs/validation/BFE-CORRECTION-2026-10-18.md)",
      "unit": "ft NAVD88",
      "value": 369.1
    },
    {
      "field": "lowestAdjacentGradeFtNavd88",
      "source": "owner-supplied site constants (BONEBANK_SITE_CONSTANTS.LAG)",
      "unit": "ft NAVD88",
      "value": 377.2
    },
    {
      "field": "finishedFloorElevationFtNavd88",
      "source": "owner-supplied site constants (BONEBANK_SITE_CONSTANTS.FFE)",
      "unit": "ft NAVD88",
      "value": 382.5
    },
    {
      "field": "bermCrestFtNavd88",
      "source": "owner-supplied site constants (BONEBANK_SITE_CONSTANTS.BERM)",
      "unit": "ft NAVD88",
      "value": 379.8
    }
  ],
  "title": "Q100 design event (FEMA BFE 369.1 ft)"
}
